{
  "$schema": "http://json-schema.org/draft-07/schema#",
  "type": "array",
  "description": "Schema for attribute_assign_to_set data type - array of attribute assignments to sets",
  "items": {
    "type": "object",
    "properties": {
      "attributeSetId": { "type": "string" },
      "attributeGroupId": { "type": "number" },
      "attributeCode": { "type": "string" },
      "sortOrder": { "type": "number" },
      "attribute_set_name": { "type": "string" },
      "attribute_group_name": { "type": "string" },
      "attribute_code": { "type": "string" },
      "sort_order": { "type": "number" }
    },
    "required": ["attributeSetId", "attributeCode"]
  }
}

