[
    {
        "attributeSetId": "Building Materials",
        "attributeGroupId": 7,
        "attributeCode": "br_brand",
        "sortOrder": 10,
        "attribute_set_name": "Building Materials",
        "attribute_group_name": "Product Details",
        "attribute_code": "br_brand",
        "sort_order": 10
    },
    {
        "attributeSetId": "Building Materials",
        "attributeGroupId": 7,
        "attributeCode": "br_unit_of_measure",
        "sortOrder": 11,
        "attribute_set_name": "Building Materials",
        "attribute_group_name": "Product Details",
        "attribute_code": "br_unit_of_measure",
        "sort_order": 11
    },
    {
        "attributeSetId": "Building Materials",
        "attributeGroupId": 7,
        "attributeCode": "br_project_types",
        "sortOrder": 12,
        "attribute_set_name": "Building Materials",
        "attribute_group_name": "Product Details",
        "attribute_code": "br_project_types",
        "sort_order": 12
    },
    {
        "attributeSetId": "Building Materials",
        "attributeGroupId": 7,
        "attributeCode": "br_lumber_species",
        "sortOrder": 13,
        "attribute_set_name": "Building Materials",
        "attribute_group_name": "Product Details",
        "attribute_code": "br_lumber_species",
        "sort_order": 13
    },
    {
        "attributeSetId": "Building Materials",
        "attributeGroupId": 7,
        "attributeCode": "br_lumber_grade",
        "sortOrder": 14,
        "attribute_set_name": "Building Materials",
        "attribute_group_name": "Product Details",
        "attribute_code": "br_lumber_grade",
        "sort_order": 14
    },
    {
        "attributeSetId": "Building Materials",
        "attributeGroupId": 7,
        "attributeCode": "br_lumber_treatment",
        "sortOrder": 15,
        "attribute_set_name": "Building Materials",
        "attribute_group_name": "Product Details",
        "attribute_code": "br_lumber_treatment",
        "sort_order": 15
    },
    {
        "attributeSetId": "Building Materials",
        "attributeGroupId": 7,
        "attributeCode": "br_lumber_certification",
        "sortOrder": 16,
        "attribute_set_name": "Building Materials",
        "attribute_group_name": "Product Details",
        "attribute_code": "br_lumber_certification",
        "sort_order": 16
    },
    {
        "attributeSetId": "Building Materials",
        "attributeGroupId": 7,
        "attributeCode": "br_drywall_thickness",
        "sortOrder": 17,
        "attribute_set_name": "Building Materials",
        "attribute_group_name": "Product Details",
        "attribute_code": "br_drywall_thickness",
        "sort_order": 17
    },
    {
        "attributeSetId": "Building Materials",
        "attributeGroupId": 7,
        "attributeCode": "br_drywall_product_type",
        "sortOrder": 18,
        "attribute_set_name": "Building Materials",
        "attribute_group_name": "Product Details",
        "attribute_code": "br_drywall_product_type",
        "sort_order": 18
    },
    {
        "attributeSetId": "Building Materials",
        "attributeGroupId": 7,
        "attributeCode": "br_drywall_fire_rating",
        "sortOrder": 19,
        "attribute_set_name": "Building Materials",
        "attribute_group_name": "Product Details",
        "attribute_code": "br_drywall_fire_rating",
        "sort_order": 19
    },
    {
        "attributeSetId": "Building Materials",
        "attributeGroupId": 7,
        "attributeCode": "br_drywall_edge_type",
        "sortOrder": 20,
        "attribute_set_name": "Building Materials",
        "attribute_group_name": "Product Details",
        "attribute_code": "br_drywall_edge_type",
        "sort_order": 20
    },
    {
        "attributeSetId": "Building Materials",
        "attributeGroupId": 7,
        "attributeCode": "br_window_material",
        "sortOrder": 21,
        "attribute_set_name": "Building Materials",
        "attribute_group_name": "Product Details",
        "attribute_code": "br_window_material",
        "sort_order": 21
    },
    {
        "attributeSetId": "Building Materials",
        "attributeGroupId": 7,
        "attributeCode": "br_window_operation_type",
        "sortOrder": 22,
        "attribute_set_name": "Building Materials",
        "attribute_group_name": "Product Details",
        "attribute_code": "br_window_operation_type",
        "sort_order": 22
    },
    {
        "attributeSetId": "Building Materials",
        "attributeGroupId": 7,
        "attributeCode": "br_window_glazing_type",
        "sortOrder": 23,
        "attribute_set_name": "Building Materials",
        "attribute_group_name": "Product Details",
        "attribute_code": "br_window_glazing_type",
        "sort_order": 23
    },
    {
        "attributeSetId": "Building Materials",
        "attributeGroupId": 7,
        "attributeCode": "br_window_energy_star",
        "sortOrder": 24,
        "attribute_set_name": "Building Materials",
        "attribute_group_name": "Product Details",
        "attribute_code": "br_window_energy_star",
        "sort_order": 24
    },
    {
        "attributeSetId": "Building Materials",
        "attributeGroupId": 7,
        "attributeCode": "br_door_type",
        "sortOrder": 25,
        "attribute_set_name": "Building Materials",
        "attribute_group_name": "Product Details",
        "attribute_code": "br_door_type",
        "sort_order": 25
    },
    {
        "attributeSetId": "Building Materials",
        "attributeGroupId": 7,
        "attributeCode": "br_door_material",
        "sortOrder": 26,
        "attribute_set_name": "Building Materials",
        "attribute_group_name": "Product Details",
        "attribute_code": "br_door_material",
        "sort_order": 26
    },
    {
        "attributeSetId": "Building Materials",
        "attributeGroupId": 7,
        "attributeCode": "br_door_core_type",
        "sortOrder": 27,
        "attribute_set_name": "Building Materials",
        "attribute_group_name": "Product Details",
        "attribute_code": "br_door_core_type",
        "sort_order": 27
    },
    {
        "attributeSetId": "Building Materials",
        "attributeGroupId": 7,
        "attributeCode": "br_fastener_type",
        "sortOrder": 28,
        "attribute_set_name": "Building Materials",
        "attribute_group_name": "Product Details",
        "attribute_code": "br_fastener_type",
        "sort_order": 28
    },
    {
        "attributeSetId": "Building Materials",
        "attributeGroupId": 7,
        "attributeCode": "br_fastener_subtype",
        "sortOrder": 29,
        "attribute_set_name": "Building Materials",
        "attribute_group_name": "Product Details",
        "attribute_code": "br_fastener_subtype",
        "sort_order": 29
    },
    {
        "attributeSetId": "Building Materials",
        "attributeGroupId": 7,
        "attributeCode": "br_fastener_material",
        "sortOrder": 30,
        "attribute_set_name": "Building Materials",
        "attribute_group_name": "Product Details",
        "attribute_code": "br_fastener_material",
        "sort_order": 30
    },
    {
        "attributeSetId": "Building Materials",
        "attributeGroupId": 7,
        "attributeCode": "br_fastener_coating",
        "sortOrder": 31,
        "attribute_set_name": "Building Materials",
        "attribute_group_name": "Product Details",
        "attribute_code": "br_fastener_coating",
        "sort_order": 31
    },
    {
        "attributeSetId": "Building Materials",
        "attributeGroupId": 7,
        "attributeCode": "br_fastener_head_type",
        "sortOrder": 32,
        "attribute_set_name": "Building Materials",
        "attribute_group_name": "Product Details",
        "attribute_code": "br_fastener_head_type",
        "sort_order": 32
    },
    {
        "attributeSetId": "Building Materials",
        "attributeGroupId": 7,
        "attributeCode": "br_fastener_drive_type",
        "sortOrder": 33,
        "attribute_set_name": "Building Materials",
        "attribute_group_name": "Product Details",
        "attribute_code": "br_fastener_drive_type",
        "sort_order": 33
    },
    {
        "attributeSetId": "Building Materials",
        "attributeGroupId": 7,
        "attributeCode": "br_ppe_category",
        "sortOrder": 34,
        "attribute_set_name": "Building Materials",
        "attribute_group_name": "Product Details",
        "attribute_code": "br_ppe_category",
        "sort_order": 34
    },
    {
        "attributeSetId": "Building Materials",
        "attributeGroupId": 7,
        "attributeCode": "br_ppe_ansi_standard",
        "sortOrder": 35,
        "attribute_set_name": "Building Materials",
        "attribute_group_name": "Product Details",
        "attribute_code": "br_ppe_ansi_standard",
        "sort_order": 35
    },
    {
        "attributeSetId": "Building Materials",
        "attributeGroupId": 7,
        "attributeCode": "br_ppe_hard_hat_type",
        "sortOrder": 36,
        "attribute_set_name": "Building Materials",
        "attribute_group_name": "Product Details",
        "attribute_code": "br_ppe_hard_hat_type",
        "sort_order": 36
    },
    {
        "attributeSetId": "Building Materials",
        "attributeGroupId": 7,
        "attributeCode": "br_ppe_hard_hat_class",
        "sortOrder": 37,
        "attribute_set_name": "Building Materials",
        "attribute_group_name": "Product Details",
        "attribute_code": "br_ppe_hard_hat_class",
        "sort_order": 37
    },
    {
        "attributeSetId": "Building Materials",
        "attributeGroupId": 7,
        "attributeCode": "br_ppe_nrr_rating",
        "sortOrder": 38,
        "attribute_set_name": "Building Materials",
        "attribute_group_name": "Product Details",
        "attribute_code": "br_ppe_nrr_rating",
        "sort_order": 38
    },
    {
        "attributeSetId": "Building Materials",
        "attributeGroupId": 7,